{
  "manifest": {
    "kind": "directive.campaignStateProjection",
    "schemaVersion": 2,
    "id": "directive:campaign-projection:celandine-enemys-garden",
    "title": "U.S.S. Celandine: Enemy's Garden Open-World State Projection",
    "version": "0.1.0-pre-alpha.1",
    "status": "pre-alpha"
  },
  "sourcePackage": {
    "packageId": "directive:campaign-package:celandine-enemys-garden",
    "packagePath": "packages/bundled/celandine/enemys-garden.campaign-package.json",
    "campaignId": "enemys-garden",
    "packageVersionPinned": true,
    "packageVersion": "0.1.0-pre-alpha.1"
  },
  "stateDomains": [
    "campaign",
    "player",
    "crew",
    "ship",
    "mission",
    "pressureLedger",
    "relationships",
    "commandCulture",
    "commandBearing",
    "commandCompetence",
    "values",
    "directives",
    "canon",
    "campaignTracks",
    "campaignAssets",
    "turnLedger",
    "commandLog",
    "ui",
    "settings",
    "captainState",
    "worldState",
    "storyArcLedger",
    "questLedger",
    "dynamicQuestCatalog",
    "knowledgeLedger",
    "threadLedger",
    "eventLedger",
    "attentionState",
    "timeLedger",
    "continuity",
    "sceneReconciliation",
    "runtimeTracking",
    "flags"
  ],
  "hiddenStatePolicy": {
    "hiddenDomains": [
      "worldState.fronts",
      "worldState.clocks",
      "campaignTracks.raw values",
      "director-only knowledge",
      "reaction diagnostics"
    ],
    "playerFacingDomains": [
      "campaign",
      "player",
      "ship",
      "mission",
      "known world locations and routes",
      "known facts",
      "active quest objectives",
      "named assets and obligations"
    ],
    "normalUiMustNotExposeRawValues": true
  },
  "projectionPolicy": {
    "copied": [
      "ship and crew package baselines",
      "world locations, routes, factions, actors, fronts, clocks, and state tracks",
      "static quest, thread, and ending templates"
    ],
    "referenced": [
      "immutable package ids",
      "mission graph assets",
      "crew dataset cards",
      "passive regional maps"
    ],
    "generated": [
      "player officer identity and dossier",
      "campaign save identifiers",
      "future dynamic quest proposals",
      "turn and command logs"
    ],
    "derived": [
      "quest availability",
      "front consequences",
      "player-safe food-system summaries",
      "finale configuration and completion band"
    ]
  },
  "invariants": [
    "Package templates remain immutable after projection; playthrough outcomes belong to campaign state.",
    "Narration and Command Log prose never override committed structured state.",
    "Raw relationship, track, clock, and hidden-truth values are excluded from normal player-facing UI.",
    "The player character dialogue, thoughts, feelings, decisions, and motives are never authored by the package or Director.",
    "No single failed check ends a mission or deletes the only campaign-critical evidence route.",
    "Food, routes, locations, actors, factions, and delegated assignments persist outside the foreground quest.",
    "The finale and conclusion band derive from committed campaign state rather than a fixed branch."
  ],
  "initialState": {
    "campaign": {
      "id": "campaign.enemys-garden.initial",
      "templateCampaignId": "enemys-garden",
      "title": "Enemy's Garden",
      "status": "active",
      "createdAt": null,
      "openingStardate": 53944.1,
      "openingMinuteOfDay": 1040,
      "currentStardate": 53944.1,
      "openingYear": 2376,
      "theater": "The Cyradon Relief Cluster",
      "saveSchemaVersion": 2
    },
    "activeCampaignPackage": {
      "packageId": "directive:campaign-package:celandine-enemys-garden",
      "packageVersion": "0.1.0-pre-alpha.1",
      "packagePath": "packages/bundled/celandine/enemys-garden.campaign-package.json",
      "immutableTemplate": true
    },
    "player": {
      "id": "player-commander",
      "creationStatus": "pending",
      "rank": "Commander",
      "billet": "Executive Officer",
      "role": "Newly assigned XO, opening Acting Captain, and principal Cyradon relief mission commander",
      "species": null,
      "personalValues": []
    },
    "crew": {
      "seniorCrewIds": [
        "maia-dorel",
        "player-commander",
        "rinn-sorell",
        "sovek",
        "anika-bost",
        "thena-zharis",
        "calen-varo",
        "nomi-keth",
        "emet-raal"
      ],
      "supportingCrewIds": [
        "sana-mir",
        "arel-lio",
        "dara-pev",
        "karel-maret",
        "calla-thorn"
      ],
      "cohortIds": [
        "celandine-relief-core",
        "agricultural-module-specialists",
        "postwar-transfers",
        "civilian-liaison-riders"
      ],
      "casualties": [],
      "reassignments": [],
      "relationshipModel": {
        "dimensions": [
          "professionalConfidence",
          "integrityTrust",
          "personalRapport"
        ],
        "rawValuesHidden": true,
        "startingFrame": "The crew accepts the player rank and orders, but the Commander is new, Dorel is suddenly unavailable, Sorell expected promotion, and the mission places humanitarian urgency against uncertain science."
      }
    },
    "ship": {
      "id": "uss-celandine",
      "name": "U.S.S. Celandine",
      "class": "Norway-class",
      "registry": "NCC-64941",
      "status": "operational",
      "condition": "The Celandine has been in the Cyradon Relief Cluster for four days, completing baseline agricultural scans and unloading clean seed stock at Verdant Station. The newly assigned Commander has served as Executive Officer for less than a week. During the opening survey at Arda II, a K-17 processing tower releases a dormant control-spore cloud and Captain Maia Dorel is exposed while directing an evacuation. Medical quarantine removes Dorel from duty and Starfleet confirms the player as Acting Captain while the harvest, public-health, and regional transition mission continue.",
      "technicalDebt": [
        "Standard transporter biofilters do not reliably detect dormant K-17 control spores without slow secondary screening.",
        "Agricultural laboratory loads compete with shield and long-range sensor demand through one lateral EPS trunk.",
        "One seed freezer has intermittent cryogenic control after wartime damage and cannot be trusted for unique parent stock.",
        "The port agricultural shuttle has degraded intake seals after repeated contaminated-atmosphere work.",
        "Sterilization drones can eliminate K-17 but also damage beneficial soil microbiota and require scarce replacement catalyst."
      ],
      "stores": {
        "cleanSeedParentLots": 18,
        "grayleafTrialLots": 9,
        "portableSoilBioreactors": 6,
        "fieldSensorKits": 22,
        "sterilizationDroneFlights": 8,
        "agriculturalShuttles": 2,
        "standardShuttles": 3,
        "medicalIsolationBeds": 18,
        "temporaryEvacuationBerths": 140,
        "industrialReplicatorFeedstock": "moderate; enough for targeted irrigation, storage, or processing work, not every world",
        "emergencyRationDaysForCluster": "less than two days at full regional demand"
      },
      "systemRestrictions": [
        "enhanced agricultural quarantine after Arda II exposure"
      ],
      "damage": []
    },
    "mission": {
      "activeQuestId": "prelude-the-first-harvest",
      "activeGraphId": "celandine.enemys-garden.prelude-the-first-harvest",
      "phaseId": "phase.command-succession",
      "status": "active"
    },
    "pressureLedger": [],
    "relationships": {
      "dimensions": [
        "professionalConfidence",
        "integrityTrust",
        "personalRapport"
      ],
      "rawValuesHidden": true,
      "records": []
    },
    "commandCulture": {
      "traits": [],
      "history": []
    },
    "commandBearing": {
      "observations": [],
      "history": []
    },
    "commandCompetence": {
      "inspiration": 0,
      "resolve": 0,
      "eligibleBearingMoments": []
    },
    "values": [],
    "directives": [
      "Protect civilian life and prevent mass famine in the Cyradon Relief Cluster.",
      "Audit K-17 crop, soil, water, processing, and biomarker risks without destroying essential food systems by default.",
      "Support credible crop alternatives, ecological recovery, and local technical capacity.",
      "Protect lawful medical privacy, informed consent, seed custody, and public access to consequential evidence.",
      "Secure Dominion control material and parent strains under accountable custody.",
      "Avoid assuming permanent civil or agricultural authority where legitimate local institutions can function.",
      "Maintain lawful Celandine command continuity while Captain Dorel is medically unavailable."
    ],
    "canon": {
      "openingStardate": 53944.1,
      "year": 2376,
      "dominionWarStatus": "The Dominion War has ended recently. Demobilization, shortages, war damage, Cardassian recovery, displaced populations, and uncertain emergency authority remain current.",
      "voyagerStatus": "Voyager remains missing in the Delta Quadrant and its fate is unknown to the Federation. It does not intersect this campaign.",
      "canonBoundary": "Use canon factions, technology, uniforms, and 2376 conditions as background. The Celandine, crew, Cyradon cluster, K-17 local history, and outcomes are original and canon-adjacent."
    },
    "campaignTracks": {
      "records": [
        {
          "id": "famine-pressure",
          "value": 3,
          "min": 0,
          "max": 10,
          "visibility": "hidden",
          "history": []
        },
        {
          "id": "biomarker-spread",
          "value": 3,
          "min": 0,
          "max": 10,
          "visibility": "hidden",
          "history": []
        },
        {
          "id": "alternative-readiness",
          "value": 1,
          "min": 0,